<?xml version="1.0" encoding="UTF-8"?>
<!-- Edited with XRT Chief Observer Tool version 2.0x40 (2080) -->
<!DOCTYPE FLT_TBL SYSTEM "XRTFLT.dtd">
<FLT_TBL>
  <modified author="SHIMOJO, Masumi" dateTime="2008-02-28T03:34:43Z" />
  <name>2005090151-2</name>
  <COT_info deleted="FALSE" lastUsed="2014-12-24T17:33:17Z" version="0001" locked="FALSE"
    tag="0000667D42C8/0001" COTversion="2.0x40" COTbuild="2080" Mutable="TRUE" />
  <COT_slot>-1</COT_slot>
  <RD name="A1" unit="(1/16)MdpExposureNumber">0</RD>
  <RD name="A2" unit="(1/16)MdpExposureNumber">8</RD>
  <RD name="A3" unit="(1/16)MdpExposureNumber">24</RD>
  <RD name="A4" unit="(1/16)MdpExposureNumber">60</RD>
  <RD name="A5" unit="(1/16)MdpExposureNumber">128</RD>
  <RD name="A6" unit="(1/16)MdpExposureNumber">179</RD>
  <RD name="B1" unit="(1/16)MdpExposureNumber">0</RD>
  <RD name="B2" unit="(1/16)MdpExposureNumber">1</RD>
  <RD name="B3" unit="(1/16)MdpExposureNumber">51</RD>
  <RD name="B4" unit="(1/16)MdpExposureNumber">0</RD>
  <RD name="B5" unit="(1/16)MdpExposureNumber">265</RD>
  <RD name="B6" unit="(1/16)MdpExposureNumber">371</RD>
</FLT_TBL>
